{
  "id": "wadi_tarfan",
  "map": "wadi_tarfan",
  "ends": {
    "friendly": { "camp": { "at": [7, 7], "size": [2, 2] } },
    "hostile": { "camp": { "at": [39, 39], "size": [2, 2] } }
  },
  "tunnels": {
    "friendly": [
      { "id": "wt_f_north", "points": [[13, 11], [17, 13], [22, 15]], "capacity": 1 },
      { "id": "wt_f_west", "points": [[11, 13], [12, 17], [13, 21]], "capacity": 2 }
    ],
    "hostile": [
      { "id": "wt_h_south", "points": [[34, 36], [30, 34], [25, 32]], "capacity": 1 },
      { "id": "wt_h_east", "points": [[36, 34], [35, 30], [34, 26]], "capacity": 3 }
    ]
  },
  "income_zones": [
    { "zone": "centre_ford", "rate_per_min": 60 },
    { "zone": "ne_ford", "rate_per_min": 40 },
    { "zone": "sw_ford", "rate_per_min": 40 },
    { "zone": "bluff_near_0", "rate_per_min": 20 },
    { "zone": "bluff_near_1", "rate_per_min": 20 },
    { "zone": "bluff_far_0", "rate_per_min": 20 },
    { "zone": "bluff_far_1", "rate_per_min": 20 },
    { "zone": "farm_near_0", "rate_per_min": 20 },
    { "zone": "farm_near_1", "rate_per_min": 20 },
    { "zone": "farm_far_0", "rate_per_min": 20 },
    { "zone": "farm_far_1", "rate_per_min": 20 }
  ]
}
