{
  "id": "tel_marum",
  "map": "tel_marum",
  "ends": {
    "friendly": { "camp": { "at": [21, 46], "size": [2, 2] } },
    "hostile": { "camp": { "at": [25, 14], "size": [2, 2] } }
  },
  "tunnels": {
    "friendly": [
      { "id": "tm_s_west", "points": [[22, 44], [14, 38], [12, 30]], "capacity": 4 },
      { "id": "tm_s_east", "points": [[26, 44], [34, 40], [38, 34]], "capacity": 4 }
    ],
    "hostile": [
      { "id": "tm_n_west", "points": [[22, 17], [16, 22], [13, 27]], "capacity": 4 },
      { "id": "tm_n_east", "points": [[29, 17], [33, 22], [36, 27]], "capacity": 4 }
    ]
  },
  "income_zones": [
    { "zone": "pass", "rate_per_min": 40 },
    { "zone": "approach", "rate_per_min": 40 },
    { "zone": "overwatch_east", "rate_per_min": 20 },
    { "zone": "overwatch_west", "rate_per_min": 20 },
    { "zone": "ammo_draw", "rate_per_min": 20 }
  ]
}
